{
  "$schema":"https://json-schema.org/draft/2020-12/schema",
  "$id":"urn:herdr:schema:criterion-registry:1.1",
  "type":"object","additionalProperties":false,
  "required":["schema_version","task_id","task_contract_revision","criteria"],
  "properties":{
    "schema_version":{"const":"herdr-criterion-registry/1.1"},
    "task_id":{"type":"string","minLength":1},
    "task_contract_revision":{"type":"string","pattern":"^sha256:[0-9a-f]{64}$"},
    "criteria":{"type":"array","minItems":1,"items":{"type":"object","additionalProperties":false,"required":["criterion_id","required","statement","expected_evidence_types"],"properties":{"criterion_id":{"type":"string","minLength":1},"required":{"type":"boolean"},"statement":{"type":"string","minLength":1},"expected_evidence_types":{"type":"array","minItems":1,"uniqueItems":true,"items":{"type":"string","minLength":1}}}}}
  }
}
